{
  "category": "keynote",
  "title": "Keynote Address",
  "subtitle": "Design and Time: A Historical Perspective",
  "description": "Opening keynote lecture",
  "day": 1,
  "date": "2026-09-03",
  "start_time": "09:30",
  "end_time": "10:30",
  "location": "Design Museum",
  "room": "Main Hall",
  "visibility": "public"
}
