{
  "category": "meeting",
  "title": "DHS Annual General Meeting",
  "subtitle": "Members' meeting",
  "description": "Annual General Meeting of the Design History Society",
  "day": 2,
  "date": "2026-09-04",
  "start_time": "16:00",
  "end_time": "17:00",
  "location": "Design Museum",
  "room": "Main Hall",
  "visibility": "public"
}
