{
  "category": "social",
  "title": "Networking Event",
  "subtitle": "Early career researchers meet and greet",
  "description": "Structured networking session for early career researchers to meet established scholars in the field",
  "day": 2,
  "date": "2026-09-04",
  "start_time": "18:00",
  "end_time": "19:30",
  "location": "Design Museum",
  "room": "Main Atrium",
  "visibility": "public"
}
