{
  "category": "social",
  "title": "Student Social",
  "subtitle": "Informal drinks for postgraduate students",
  "description": "An opportunity for postgraduate students to meet and network in an informal setting",
  "day": 1,
  "date": "2026-09-03",
  "start_time": "20:30",
  "end_time": "23:00",
  "location": "The Crown Pub",
  "room": null,
  "visibility": "public"
}
