{
  "category": "welcome",
  "title": "Welcome Address",
  "subtitle": "Opening of the conference",
  "description": "Welcome address by the DHS Chair and conference organisers",
  "day": 1,
  "date": "2026-09-03",
  "start_time": "09:00",
  "end_time": "09:30",
  "location": "Design Museum",
  "room": "Main Hall",
  "visibility": "public"
}
