{
  "category": "other",
  "title": "Film Screening + Discussion",
  "subtitle": "Design in Documentary Film",
  "description": "Screening of selected design documentaries followed by panel discussion",
  "day": 2,
  "date": "2026-09-04",
  "start_time": "17:30",
  "end_time": "19:30",
  "location": "Design Museum",
  "room": "Cinema",
  "visibility": "public"
}
