{
  "category": "social",
  "title": "Evening Reception",
  "subtitle": "Welcome drinks reception",
  "description": "Welcome reception for all conference delegates",
  "day": 1,
  "date": "2026-09-03",
  "start_time": "18:00",
  "end_time": "20:00",
  "location": "Design Museum",
  "room": "Main Atrium",
  "visibility": "public"
}
