{
  "category": "workshop",
  "title": "Publishing Workshop #2: Explorations",
  "subtitle": "Getting published in design history journals",
  "description": "Practical workshop on preparing and submitting articles to design history journals",
  "day": 2,
  "date": "2026-09-04",
  "start_time": "14:00",
  "end_time": "15:30",
  "location": "Design Museum",
  "room": "Seminar Room 2",
  "visibility": "public"
}
